氏名,E-Mail,,,
さっぽろ美容クリニック,sapporo.b.clinic@gmail.com,,,
L’or Clinic Omotesando,info.lorclinic@gmail.com,,,
聖心美容クリニック,webcenter@seishin.info,,,
医療法人社団 大谷地形成外科・美容外科クリニック,okbc-aza@cameo.plala.or.jp,,,
電車通りレーザー美容クリニック,info@lb-clinic.com,,,
羽賀スキンケアクリニック,skincare@haga-sc.jp,,,
五稜郭大村美容形成クリニック,info@5biyou.com,,,
ABCクリニック 札幌院,abc-clinic.com,,,
レジーナクリニック,support@reginaclinic.jp,,,
新さっぽろウィメンズ ヘルス＆ビューティークリニック,wbhbclinic@gmail.com,,,
白石ガーデンプレイス皮膚科クリニック,shop@shiroishi-sgs.shop-pro.jp,,,
平岡皮膚科スキンケアクリニック,info@hiraoka-hifuka.com,,,
ゴリラクリニック,pr@gorilla.clinic,,,
エミナルクリニック,info@eminal-clinic.jp,,,
札幌中央形成外科,info@chuokeisei.or.jp,,,
RDクリニック,cell@rdclinic.jp,,,
きちかわクリニック,kckwcl3323＠icloud.com,,,
駅前皮ふ科クリニック,info@ekimaehifu.com,,,
Revo.Clinic,info@revoclinic.jp,,,
池袋スカイクリニック,skyclinic@clinic-for-men.com,,,
共立美容外科,info@kyoritsu-biyo.com,,,
青森タウン形成外科クリニック,info-a@keisei.ne.jp,,,
皮膚科 岡田医院,yoyaku@otaclinic.net,,,
あきた美容クリニック,info@akita-biyo.clinic,,,
元町形成スキンクリニック,0453073720m@gmail.com,,,
Ｅ．肌クリニック不来方,e.hada@jp-members.net,,,
水沢形成外科医院,info.mps@mizusawa-p.sakura.ne.jp,,,
八戸タウン形成外科クリニック,info-h@keisei.ne.jp,,,
美容鍼とお灸の健康サロン いろはり,biyouhari@irohari.jp,,,
A CLINIC,ginza@a-clinic.net,,,
CLASSY 仙台美容外科・美容皮膚科,info@sendai-bc.net,,,
ブランクリニック,info_blancclinic@bccl.jp,,,
レナトゥスクリニック,info@renatusclinic.jp,,,
フェイス美容外科,support@face-cs.com,,,
ディオクリニック,info@dio-clinic.jp,,,
石倉クリニック 水戸院,info@ishikura-clinic.jp,,,
keiクリニック,info@kei.clinic,,,
黒須クリニック,cross1@alles.or.jp,,,
GLANZ CLINIC (グランツクリニック),info@glanz-clinic.com,,,
倉持整形外科・皮膚科美容皮膚科,kuramochi.hp@gmail.com,,,
Apollon Clinic【アポロンクリニック】,apollon.clinic.staff@gmail.com,,,
宇都宮竹内クリニック,info@takeuchiclinic.com,,,
宇都宮クリニックビレッジ,info@u-clinicvil.com,,,
宇都宮スキンケアクリニック,skincare@beige.ocn.ne.jp,,,
MSCルナクリニック 宇都宮本院,lunaclinic.ec@gmail.com,,,
セルフィッシュビューティー,info@s-beauty.jp,,,
城本クリニック,info@shiromoto.to,,,
シンシアガーデンクリニック高崎院,info@sincere-takasaki.com,,,
高崎東口クリニック,info@takasaki-eg-cl.jp,,,
前橋CLクリニック,maebashi@cl-clinic.co.jp,,,
アリエル美容クリニック 大宮院,info@ariel.clinic,,,
ティアラクリニック川越院,info@tiara.clinic,,,
レイクタウンクリニック,business@laketownclinic.jp,,,
BRIGHTS beauty clinic,info@brights-beauty.jp,,,
EMMO FACE CLINIC,info.omiya@emmoclinic.com,,,
オーダーメイド・クリニックkumagaya,omc.kumagaya@gmail.com,,,
浦和第一美容クリニック,info@urawabiyou.com,,,
なすはらクリニック,nasuhara.cl@gmail.com,,,
NARU Beauty Clinic,info@naruclinic-chiba.jp,,,
千葉中央美容形成クリニック,info@chiba-biyo.com,,,
HSクリニック（医療法人社団HS会）,tohm@hs-c.ne.jp,,,
マイ形成外科スキンクリニック,maikeisei31610@g.inet489.jp,,,
Y&Mクリニック 幕張,info@y-m.clinic,,,
まぶたとなみだのクリニック千葉 ,chiba@oculofacial.clinic,,,
自由が丘クリニック ソフィア,info@clinicsophia.com,,,
肌と歯のクリニック東京ベイ幕張,hadatohanoclinic@gmail.com,,,
サンライズ美容外科,chiba@sunrise-biyo.com,,,
あおばクリニック千葉院,info@aoba-cancel.com,,,
シャルムクリニック,info@charme-clinique.jp,,,
きらきらクリニック,info@kirakira-clinic.com,,,
マリンクリニック,ask@marine-clinic.com,,,
船橋ゆーかりクリニック,info@eucaly.org,,,
くぼたクリニック松戸五香,kubotaclinic.goko@gmail.com,,,
リゼクリニック,pr@rizeclinic.com,,,
アロマ美容外科クリニック,a-b-c@krb.biglobe.ne.jp,,,
Cecilia Clinic セシリアクリニック,info@cecilia-clinic.jp,,,
マスダクリニック,info@masuda-keisei-hifu.com,,,
メディカルブロー,info@ml.0050.co.jp,,,
Floraエイジングケアクリニック,info@flora-ac.clinic,,,
ヨーダー公子クリニック川崎院,kimikoyclinic@gmail.com,,,
藤沢美容クリニック,info@fujisawa-biyo.jp,,,
Days Beauty Clinic,info@days-clinic.com,,,
